{
  "artifact_outputs": [
    {
      "artifact_id": "scan\\candidate_list_avwap_reclaim.json",
      "artifact_type": "candidate_list",
      "schema_version": "v1.0.0"
    },
    {
      "artifact_id": "scan\\candidate_list_base_breakout.json",
      "artifact_type": "candidate_list",
      "schema_version": "v1.0.0"
    },
    {
      "artifact_id": "scan\\candidate_list_trend_pullback.json",
      "artifact_type": "candidate_list",
      "schema_version": "v1.0.0"
    },
    {
      "artifact_id": "dashboard\\dashboard_payload.json",
      "artifact_type": "dashboard_payload",
      "schema_version": "v1.0.0"
    },
    {
      "artifact_id": "packets\\pkt_aapl_20250918_d8c38d66e739f0e1.json",
      "artifact_type": "packet",
      "schema_version": "v1.0.0"
    },
    {
      "artifact_id": "rankings\\ranking.json",
      "artifact_type": "ranking",
      "schema_version": "v1.0.0"
    }
  ],
  "artifact_type": "run_manifest",
  "as_of_date": "2025-09-18",
  "config_fingerprint": "7da318e9bf2a3f80782b3370fe5246eff1be663b92e098a6cfdb97b904eb55c7",
  "environment": "local",
  "generated_at": "2026-04-20T22:01:19.760585Z",
  "inputs": {
    "market_data_provider": "yfinance",
    "universe_name": "liquid_us_equities"
  },
  "run_id": "run_local_20250918_3e3337a6d2837850",
  "runtime_mode": "eod",
  "schema_version": "v1.0.0"
}