{
  "artifact_outputs": [
    {
      "artifact_id": "scan\\candidate_list_avwap_reclaim.json",
      "artifact_type": "candidate_list",
      "schema_version": "v1.0.0"
    },
    {
      "artifact_id": "scan\\candidate_list_base_breakout.json",
      "artifact_type": "candidate_list",
      "schema_version": "v1.0.0"
    },
    {
      "artifact_id": "scan\\candidate_list_trend_pullback.json",
      "artifact_type": "candidate_list",
      "schema_version": "v1.0.0"
    },
    {
      "artifact_id": "dashboard\\dashboard_payload.json",
      "artifact_type": "dashboard_payload",
      "schema_version": "v1.0.0"
    },
    {
      "artifact_id": "tracking\\decision_events.json",
      "artifact_type": "decision_event",
      "schema_version": "v1.0.0"
    },
    {
      "artifact_id": "tracking\\outcome_records.json",
      "artifact_type": "outcome_record",
      "schema_version": "v1.0.0"
    },
    {
      "artifact_id": "packets\\pkt_avrp_20250918_2c616c061bd44e79.json",
      "artifact_type": "packet",
      "schema_version": "v1.0.0"
    },
    {
      "artifact_id": "packets\\pkt_base_20250918_c5e29def4b368fa2.json",
      "artifact_type": "packet",
      "schema_version": "v1.0.0"
    },
    {
      "artifact_id": "packets\\pkt_cnfl_20250918_1affa3696e4c4b8f.json",
      "artifact_type": "packet",
      "schema_version": "v1.0.0"
    },
    {
      "artifact_id": "packets\\pkt_cnfl_20250918_621011937a1a6dc9.json",
      "artifact_type": "packet",
      "schema_version": "v1.0.0"
    },
    {
      "artifact_id": "packets\\pkt_splt_20250918_61239626aa15c622.json",
      "artifact_type": "packet",
      "schema_version": "v1.0.0"
    },
    {
      "artifact_id": "packets\\pkt_stal_20250918_7dae26353a71fda8.json",
      "artifact_type": "packet",
      "schema_version": "v1.0.0"
    },
    {
      "artifact_id": "packets\\pkt_trnd_20250918_02f95006ab180059.json",
      "artifact_type": "packet",
      "schema_version": "v1.0.0"
    },
    {
      "artifact_id": "rankings\\ranking.json",
      "artifact_type": "ranking",
      "schema_version": "v1.0.0"
    }
  ],
  "artifact_type": "run_manifest",
  "as_of_date": "2025-09-18",
  "config_fingerprint": "7da318e9bf2a3f80782b3370fe5246eff1be663b92e098a6cfdb97b904eb55c7",
  "environment": "local",
  "generated_at": "2025-09-18T21:15:00Z",
  "inputs": {
    "market_data_provider": "yfinance",
    "universe_name": "liquid_us_equities"
  },
  "run_id": "run_local_20250918_3e3337a6d2837850",
  "runtime_mode": "eod",
  "schema_version": "v1.0.0"
}